{
  "schema_version": 1,
  "name": "PIP_BOY_2000",
  "description": "Fallout 2-era amber-green phosphor",
  "copyright": "Copyright (C) 2025-2026, Alexander K <https://github.com/drA1ex>",
  "license": "GNU GPLv3",
  "colors": {
    "background": "030802",
    "panel": "071305",
    "primary": "69d540",
    "primary_dark": "25531a",
    "secondary": "a8cf45",
    "secondary_dark": "4d611d",
    "warning": "f2c14e",
    "danger": "e66b3d",
    "danger_background": "210b03",
    "text": "b9e7a5",
    "bright": "e3ffd5",
    "dim": "4c7d42",
    "border": "2e6725",
    "muted": "183419",
    "success": "8fe35d",
    "pressed_background": "245b20",
    "overlay": "010301",
    "button_background": "28230f",
    "button_border": "6d5c2b",
    "button_text": "b58c2f",
    "button_selected_background": "102306",
    "button_selected_border": "69d540",
    "button_selected_text": "8bea5d",
    "header_background": "24200e",
    "header_text": "b88d2e",
    "header_border": "5b4c24"
  }
}
